{
  "authority": "GREEN",
  "created_at": "2026-09-04T12:26:17Z",
  "expires_at": "2026-09-04T13:26:17Z",
  "id": "bess-stage-dealer-recon-202609041226",
  "kind": "kevin-engineering-request",
  "operation": "stage_composite_skill",
  "params": {
    "skill_path": "inbox/skills/dealer-vehicle-recon-command-pack-v1.json",
    "skill_sha256": "4C1C25D7F72462D6338C259142C43308BBC5134D75EE4B4F2E6D9B5791AB222A"
  },
  "schema": 1
}
