{
  "schema": 1,
  "kind": "kevin-engineering-request",
  "id": "bess-recovery-evidence-kit-v1-20260902",
  "authority": "GREEN",
  "operation": "stage_composite_skill",
  "created_at": "2026-09-02T17:06:59.926Z",
  "expires_at": "2026-09-02T18:06:59.926Z",
  "params": {
    "skill_path": "inbox/skills/kevin-recovery-evidence-kit-v1.json",
    "skill_sha256": "9ED5D4B634728AB21CDF2DA4D79E4AAB915FA1C6A08C7ABD4698DB0147A14DDA"
  }
}
