{
    "schema":  1,
    "kind":  "kevin-engineering-request",
    "id":  "grok-stage-appliance-repair-v3-202609040832",
    "authority":  "GREEN",
    "operation":  "stage_composite_skill",
    "created_at":  "2026-09-04T08:32:15-06:00",
    "expires_at":  "2026-09-04T20:32:15-06:00",
    "params":  {
                   "skill_path":  "inbox/skills/cache-valley-appliance-repair-launch-pack-v3.json",
                   "skill_sha256":  "8F7F416D332A92F5E13A9BAEDA2A72BF65EA417A25B673EC4599499659EC78D3"
               }
}