{
  "authority": "GREEN",
  "created_at": "2026-09-02T23:44:53.306Z",
  "expires_at": "2026-09-03T00:44:53.306Z",
  "id": "bess-r04-tool-teachback-20260902234453",
  "kind": "kevin-engineering-request",
  "operation": "stage_composite_skill",
  "params": {
    "skill_path": "inbox/skills/kevin-r04-evidence-and-tool-curriculum-v1.json",
    "skill_sha256": "0C1A170805CF0F294AB88597354723285A45721BE8C5F61B224EA2113E31701B"
  },
  "schema": 1
}
